[
  {
    "id": "the-kingdom-of-brandenburg-prussia",
    "name": "The Kingdom of Brandenburg-Prussia",
    "title": "prussia",
    "emote": "<:FlagBrandenburgPrussiaBP:1487249033104855253>",
    "aliases": ["<:FlagBrandenburgPrussiaBP:1487249033104855253>", "bp"],
    "flagImage": "images/flags/Brand-Prussia_Flag.png",
    "panel": "https://imgur.com/KdyfP3C",
    "escalation": {
      "name": "Land Rush",
      "effect": "On each board with :InvaderTown:/:InvaderCity:, add 1 :InvaderTown: to a land without :InvaderTown:."
    },
    "levels": [
      {
        "level": 0,
        "difficulty": 1,
        "fearCards": [0, 0, 0],
        "rules": []
      },
      {
        "level": 1,
        "difficulty": 2,
        "fearCards": [0, 0, 0],
        "rules": [
          {
            "name": "Fast Start",
            "phases": ["setup"],
            "effect": "During Setup, on each board add 1 :InvaderTown: to land #3."
          }
        ]
      },
      {
        "level": 2,
        "difficulty": 4,
        "fearCards": [0, 0, 0],
        "rules": [
          {
            "name": "Surge of Colonists",
            "phases": ["setup"],
            "effect": "When making the Invader Deck, put 1 of the Stage III cards between Stage I and Stage II.",
            "exceptions": [
              {
                "with": {
                  "any": true
                },
                "note": "The early Stage III Card this creates still gets hit by a Stage III Escalation (from the Supporting Adversary) — Escalations care about what a card is, not what stage of the game it's currently in."
              }
            ]
          }
        ]
      },
      {
        "level": 3,
        "difficulty": 6,
        "fearCards": [0, 1, 0],
        "rules": [
          {
            "name": "Efficient",
            "phases": ["setup"],
            "effect": "When making the Invader Deck, remove an additional Stage I card."
          }
        ]
      },
      {
        "level": 4,
        "difficulty": 7,
        "fearCards": [1, 1, 0],
        "rules": [
          {
            "name": "Aggressive Timetable",
            "phases": ["setup"],
            "effect": "When making the Invader Deck, remove an additional Stage II card."
          }
        ]
      },
      {
        "level": 5,
        "difficulty": 9,
        "fearCards": [1, 1, 0],
        "rules": [
          {
            "name": "Ruthlessly Efficient",
            "phases": ["setup"],
            "effect": "When making the Invader Deck, remove an additional Stage I card."
          }
        ]
      },
      {
        "level": 6,
        "difficulty": 10,
        "fearCards": [1, 1, 1],
        "rules": [
          {
            "name": "Terrifyingly Efficient",
            "phases": ["setup"],
            "effect": "When making the Invader Deck, remove all Stage I cards.",
            "exceptions": [
              {
                "with": {
                  "any": true
                },
                "note": "This can trigger a Stage III Escalation from the Supporting Adversary during Setup — e.g. even HME's Escalation, since it cares about cards advancing, not specifically the Advance Invader Cards step."
              }
            ]
          }
        ]
      }
    ]
  },
  {
    "id": "the-kingdom-of-england",
    "name": "The Kingdom of England",
    "title": "england",
    "emote": "<:FlagEngland:852366012175482900>",
    "aliases": ["<:FlagEngland:852366012175482900>", "🏴󠁧󠁢󠁥󠁮󠁧󠁿"],
    "flagImage": "images/flags/England_WrinkledFlag.png",
    "panel": "https://imgur.com/c5KzcIq",
    "lossCondition": {
      "name": "Proud & Mighty Capital",
      "effect": "If 7 or more :InvaderTown:/:InvaderCity: are ever in a single land, the Invaders win."
    },
    "escalation": {
      "name": "Building Boom",
      "effect": "On each board with :InvaderTown:/:InvaderCity:, Build in the land with the most :InvaderTown:/:InvaderCity:."
    },
    "levels": [
      {
        "level": 0,
        "difficulty": 1,
        "fearCards": [0, 0, 0],
        "rules": []
      },
      {
        "level": 1,
        "difficulty": 3,
        "fearCards": [0, 1, 0],
        "rules": [
          {
            "name": "Indentured Servants Earn Land",
            "phases": ["build"],
            "effect": "Invader Build Cards affect matching lands without Invaders if they are adjacent to at least 2 :InvaderTown:/:InvaderCity:s."
          }
        ]
      },
      {
        "level": 2,
        "difficulty": 4,
        "fearCards": [1, 1, 0],
        "rules": [
          {
            "name": "Criminals and Malcontents",
            "phases": ["setup"],
            "effect": "During Setup, on each board add 1 :InvaderCity: to land #1 and 1 :InvaderTown: to land #2."
          }
        ]
      },
      {
        "level": 3,
        "difficulty": 6,
        "fearCards": [1, 2, 1],
        "rules": [
          {
            "name": "High Immigration (I)",
            "phases": ["build"],
            "effect": "Put the \"High Immigration\" tile on the Invader board, to the left of \"Ravage\". The Invaders take this Build action each Invader phase before Ravaging. Cards slide left from Ravage to it, and from it to the discard pile. Remove the tile when a Stage II card slides onto it, putting that card in the discard."
          }
        ]
      },
      {
        "level": 4,
        "difficulty": 7,
        "fearCards": [1, 2, 2],
        "rules": [
          {
            "name": "High Immigration (full)",
            "phases": ["build"],
            "replaces": 3,
            "effect": "Put the \"High Immigration\" tile on the Invader board, to the left of \"Ravage\". The Invaders take this Build action each Invader phase before Ravaging. Cards slide left from Ravage to it, and from it to the discard pile. The tile remains out the entire game."
          }
        ]
      },
      {
        "level": 5,
        "difficulty": 9,
        "fearCards": [1, 2, 2],
        "rules": [
          {
            "name": "Local Autonomy",
            "phases": ["ongoing"],
            "effect": ":InvaderTown:/:InvaderCity: have +1 Health."
          }
        ]
      },
      {
        "level": 6,
        "difficulty": 10,
        "fearCards": [1, 2, 1],
        "rules": [
          {
            "name": "Independent Resolve",
            "phases": ["setup"],
            "effect": "During Setup, add an additional 1 :TokenFear: to the Fear Pool per player in the game."
          },
          {
            "name": "Independent Resolve",
            "phases": ["build"],
            "effect": "During any Invader Phase where you resolve no Fear Cards, perform the Build from High Immigration twice. (This has no effect if no card is on the extra Build slot.)"
          }
        ]
      }
    ]
  },
  {
    "id": "the-kingdom-of-france",
    "name": "The Kingdom of France",
    "title": "france",
    "emote": "<:FlagFrance:852366013243981885>",
    "aliases": ["<:FlagFrance:852366013243981885>", "🇫🇷"],
    "flagImage": "images/flags/France_(Plantation_Colony)_WrinkledFlag.png",
    "panel": "https://imgur.com/S8lL3cA",
    "lossCondition": {
      "name": "Sprawling Plantations",
      "effect": "Before Setup, return all but 7 :InvaderTown: per player to the box. Invaders win if you ever cannot place a :InvaderTown:."
    },
    "escalation": {
      "name": "Demand for New Cash Crops",
      "effect": "After Exploring, on each board, pick a land of the shown terrain. If it has :InvaderTown:/:InvaderCity:, add 1 :Blight:. Otherwise, add 1 :InvaderTown:. Randomly choose one of the land types shown on the card for Stage III escalations."
    },
    "doublesNotes": "Increase the pool of available :InvaderTown: by 1 per player for each level of the other Adversary being played.",
    "levels": [
      {
        "level": 0,
        "difficulty": 2,
        "fearCards": [0, 0, 0],
        "rules": []
      },
      {
        "level": 1,
        "difficulty": 3,
        "fearCards": [0, 0, 0],
        "rules": [
          {
            "name": "Frontier Explorers",
            "phases": ["explore"],
            "effect": "Except during Setup: After Invaders successfully Explore into a land which had no :InvaderTown:/:InvaderCity:, add 1 :InvaderExplorer: there."
          }
        ]
      },
      {
        "level": 2,
        "difficulty": 5,
        "fearCards": [0, 1, 0],
        "rules": [
          {
            "name": "Slave Labor",
            "phases": ["setup"],
            "effect": "During Setup, put the \"Slave Rebellion\" event under the top 3 cards of the Event Deck."
          },
          {
            "name": "Slave Labor",
            "phases": ["build"],
            "effect": "After Invaders Build in a land with 2 :InvaderExplorer: or more, replace all but 1 :InvaderExplorer: there with an equal number of :InvaderTown:."
          }
        ]
      },
      {
        "level": 3,
        "difficulty": 7,
        "fearCards": [1, 1, 0],
        "rules": [
          {
            "name": "Early Plantation",
            "phases": ["setup"],
            "effect": "During Setup, on each board add 1 :InvaderTown: to the highest-numbered land without :InvaderTown:. Add 1 :InvaderTown: to land #1.",
            "exceptions": [
              {
                "with": {
                  "any": true
                },
                "note": "For on-island Setup, place pieces for the Leading Adversary before the Supporting Adversary — on some boards, which lands already have :InvaderTown: when this resolves depends on that order."
              }
            ]
          }
        ]
      },
      {
        "level": 4,
        "difficulty": 8,
        "fearCards": [1, 1, 1],
        "rules": [
          {
            "name": "Triangle Trade",
            "phases": ["build"],